{
  "script_id": "text_structured_output_probe",
  "version": "1.3.0",
  "status": "default",
  "owner": "manju-agent-tools",
  "created_at": "2026-06-10",
  "updated_at": "2026-06-11",
  "summary": "验证文本模型 endpoint 是否真正执行 strict JSON Schema；剧本生成在 strict 不可用时改走非 strict JSON + 本地校验重试兜底。",
  "working_directory": ".",
  "entrypoints": [
    "lib/text_backends/structured_probe.py:probe_text_structured_output_backend",
    "lib/text_generator.py:ensure_structured_output_ready",
    "lib/script_generator.py:ScriptGenerator.generate",
    "server/routers/providers.py:probe_text_structured_output",
    "utils/manju_agent_ops_ipc.py:run_agent_ops",
    "utils/manju_ipc_api.py:manju_api_run_agent_ops",
    "utils/manju_ipc_dispatcher.py:manju_api_run_agent_ops",
    "utils/manju_ipc_dispatcher.py:manju_api_probe_text_structured_output"
  ],
  "source_files": [
    "lib/text_backends/structured_probe.py",
    "lib/text_backends/openai.py",
    "lib/custom_provider/endpoints.py",
    "lib/script_generator.py",
    "lib/project_manager.py",
    "utils/manju_agent_ops_ipc.py",
    "utils/manju_ipc_api.py",
    "utils/manju_ipc_dispatcher.py",
    "agent_ops/tests/text_structured_output_probe_smoke.py"
  ],
  "evidence": [
    "docs/provider-api-evidence/api-interface-matrix.md",
    "docs/provider-api-evidence/call-paths-and-custom-providers.md",
    "docs/provider-api-evidence/verification-log.md"
  ],
  "validation_commands": [
    "{python} agent_ops/tests/text_structured_output_probe_smoke.py",
    "manual:{python} -m pytest tests/test_text_structured_probe.py tests/test_openai_text_backend.py tests/test_text_backend_factory.py tests/test_custom_provider_factory.py agent_ops/tests/test_agent_script_registry.py -q",
    "git diff --check"
  ],
  "tests": [
    "agent_ops/tests/text_structured_output_probe_smoke.py",
    "agent_ops/tests/test_agent_script_registry.py",
    "tests/test_text_structured_probe.py",
    "tests/test_openai_text_backend.py",
    "tests/test_text_backend_factory.py",
    "tests/test_custom_provider_factory.py"
  ],
  "repair_write_allowlist": [
    "agent_ops",
    "lib/text_backends",
    "lib/custom_provider/endpoints.py",
    "lib/script_generator.py",
    "lib/project_manager.py",
    "server/routers/providers.py",
    "utils/manju_agent_ops_ipc.py",
    "utils/manju_ipc_api.py",
    "utils/manju_ipc_dispatcher.py",
    "tests/test_text_structured_probe.py",
    "tests/test_openai_text_backend.py",
    "tests/test_text_backend_factory.py",
    "tests/test_custom_provider_factory.py",
    "docs/provider-api-evidence"
  ],
  "failure_examples": [
    "agent_ops/registry/failure-examples/text_structured_output_probe_schema_not_enforced.json"
  ],
  "known_failures": [
    "schema_not_enforced: endpoint 返回普通 JSON 但未真正执行 native strict schema",
    "unsupported: backend capabilities 未声明 structured_output",
    "schema_rejected: 供应商或中转网关拒绝 response_format.json_schema 请求",
    "non_strict_invalid: 非 strict 兜底返回内容未通过本地 Pydantic 或 Step 1 对齐校验"
  ],
  "rollback": [
    "将本记录 status 改为 deprecated，并恢复上一个 default 版本记录",
    "回滚 lib/script_generator.py 的非 strict fallback 改动与相关 agent_ops 后端入口",
    "保留失败样例到 tests/test_text_structured_probe.py，避免再次误判"
  ],
  "notes": [
    "probe 必须使用对抗式 prompt，不能用已经合法的样例 JSON 作为唯一判断",
    "不支持 strict schema 的 endpoint 不能降级后继续伪装成 strict schema 成功",
    "剧本生成允许进入 non_strict_validated 兜底模式，但必须通过本地 Pydantic 模型校验、Step 1 ID/数量/顺序校验后才能写入 scripts/episode_N.json",
    "agent_ops 后端入口只使用当前后端进程的 sys.executable，并以 backend 根目录作为运行目录调用 registry 脚本；调用方不能传入 Python 路径或任意 agent 命令"
  ]
}
